{
  "schema_version": "1.0",
  "story_id": "rain_ferry_demo",
  "entry_point": {
    "chapter_id": "chapter_01",
    "scene_id": "scene_01",
    "event_id": "opened_copper_case"
  },
  "bindings": {
    "character_id": "lin_yan",
    "user_role_id": "traveler"
  },
  "mode_defaults": {
    "participation": "adaptive",
    "audit": "standard",
    "auto_apply": false
  }
}
